Item	Outline	Page_Lines	Text	Tokens	Keywords	Tag	Number_of_Keywords
855	4.	53.31 - 53.38	When notes or bonds are outstanding secured by a pledge of receipts or revenues, guaranteed notes or bonds either unsecured, or secured by a pledge of receipts or revenues subordinate to the pledge securing such outstanding notes or bonds, shall not be issued unless the authority shall first find and determine by resolution that notwithstanding the pledge securing such outstanding notes or bonds, the authority will have adequate means to meet its obligations on the guaranteed notes or bonds about to be issued. 	when, notes, or, bonds, are, outstanding, secured, by, a, pledge, of, receipts, or, revenues, guaranteed, notes, or, bonds, either, unsecured, or, secured, by, a, pledge, of, receipts, or, revenues, subordinate, to, the, pledge, securing, such, outstanding, notes, or, bonds, shall, not, be, issued, unless, the, authority, shall, first, find, and, determine, by, resolution, that, notwithstanding, the, pledge, securing, such, outstanding, notes, or, bonds, the, authority, will, have, adequate, means, to, meet, its, obligations, on, the, guaranteed, notes, or, bonds, about, to, be, issued	notes, bonds, outstanding, secured, pledge, receipts, revenues, guaranteed, unsecured, subordinate, securing, issued, unless, authority, determine, resolution, notwithstanding, adequate, obligations	(§8.) TITLE 36 § 2799-ddddd.4.	19
856	§ 2799-eeeee.	53.39 - 53.49	State and municipalities not liable on the bonds or notes. Notes and other obligations of the authority shall not be a debt of the state or of any municipality, and neither the state nor any municipality shall be liable thereon. The authority shall not have the power to pledge the credit, the revenues or the taxing power of the state or of any municipality, and neither the credit, the revenues nor the taxing power of the state or of any municipality shall be, or shall be deemed to be, pledged to the payment of any bonds, notes or other obligations of the authority. Each evidence of indebtedness of the authority, including the bonds and notes of the authority, shall contain a clear and explicit statement of the provisions of this section. 	state, and, municipalities, not, liable, on, the, bonds, or, notes, notes, and, other, obligations, of, the, authority, shall, not, be, a, debt, of, the, state, or, of, any, municipality, and, neither, the, state, nor, any, municipality, shall, be, liable, thereon, the, authority, shall, not, have, the, power, to, pledge, the, credit, the, revenues, or, the, taxing, power, of, the, state, or, of, any, municipality, and, neither, the, credit, the, revenues, nor, the, taxing, power, of, the, state, or, of, any, municipality, shall, be, or, shall, be, deemed, to, be, pledged, to, the, payment, of, any, bonds, notes, or, other, obligations, of, the, authority, each, evidence, of, indebtedness, of, the, authority, including, the, bonds, and, notes, of, the, authority, shall, contain, a, clear, and, explicit, statement, of, the, provisions, of, this, section	state, municipalities, liable, bonds, notes, obligations, authority, debt, municipality, neither, nor, thereon, power, pledge, credit, revenues, taxing, deemed, pledged, payment, evidence, indebtedness, contain, explicit, statement, provisions	(§8.) TITLE 36 § 2799-eeeee.	26
857	§ 2799-fffff.	53.50 - 54.8	Legal investments. Any bonds or notes issued by the authority are hereby made securities in which all public officers and bodies of this state and all municipalities, all insurance companies and associations and other persons carrying on an insurance business, all banks, bankers, trust companies, savings banks and savings associations, including savings and loan associations, building and loan associations, investment companies and other persons carrying on a banking business, all trusts, estates and guardianships and all other persons whatsoever, who are now or may hereafter be authorized to invest in bonds or other obligations of the state, may properly and legally invest funds, including capital in their control or belonging to them. The bonds and notes shall also be securities which may be deposited with and shall be received by all public officers and bodies of the state and all municipalities for any purpose for which the deposit of bonds or other obligations of the state is now or may hereafter be authorized. 	legal, investments, any, bonds, or, notes, issued, by, the, authority, are, hereby, made, securities, in, which, all, public, officers, and, bodies, of, this, state, and, all, municipalities, all, insurance, companies, and, associations, and, other, persons, carrying, on, an, insurance, business, all, banks, bankers, trust, companies, savings, banks, and, savings, associations, including, savings, and, loan, associations, building, and, loan, associations, investment, companies, and, other, persons, carrying, on, a, banking, business, all, trusts, estates, and, guardianships, and, all, other, persons, whatsoever, who, are, now, or, may, hereafter, be, authorized, to, invest, in, bonds, or, other, obligations, of, the, state, may, properly, and, legally, invest, funds, including, capital, in, their, control, or, belonging, to, them, the, bonds, and, notes, shall, also, be, securities, which, may, be, deposited, with, and, shall, be, received, by, all, public, officers, and, bodies, of, the, state, and, all, municipalities, for, any, purpose, for, which, the, deposit, of, bonds, or, other, obligations, of, the, state, is, now, or, may, hereafter, be, authorized	legal, investments, bonds, notes, issued, authority, hereby, securities, public, officers, bodies, state, municipalities, insurance, companies, associations, persons, carrying, business, banks, bankers, trust, savings, loan, building, investment, banking, trusts, estates, guardianships, whatsoever, may, hereafter, authorized, invest, obligations, properly, legally, funds, capital, control, belonging, deposited, purpose, deposit	(§8.) TITLE 36 § 2799-fffff.	45
858	1.	54.9 - 54.25	Deposit and investment of monies of the authority. 1. All moneys of the authority from whatever source derived shall be paid to the comptroller as agent of the authority, who shall not commingle such moneys with any other moneys. Such moneys shall be deposited in a separate bank account or accounts. The moneys in such accounts shall be paid out on check of the comptroller on requisition of the chairperson of the authority or of such other person as the authority may authorize to make such requisition. All deposits of such moneys shall, if required by the comptroller or the authority, be secured by obligations of the United States or of the state of New York of a market value equal at all times to the amount of the deposit and all banks and trust companies are authorized to give such security for such deposits. The comptroller and his or her legally authorized representatives shall be authorized and empowered from time to time to examine the accounts and books of the authority, including its receipts, disbursements, contracts, leases, sinking funds, investments and any other matters relating to its financial standing. 	deposit, and, investment, of, monies, of, the, authority, 1, all, moneys, of, the, authority, from, whatever, source, derived, shall, be, paid, to, the, comptroller, as, agent, of, the, authority, who, shall, not, commingle, such, moneys, with, any, other, moneys, such, moneys, shall, be, deposited, in, a, separate, bank, account, or, accounts, the, moneys, in, such, accounts, shall, be, paid, out, on, check, of, the, comptroller, on, requisition, of, the, chairperson, of, the, authority, or, of, such, other, person, as, the, authority, may, authorize, to, make, such, requisition, all, deposits, of, such, moneys, shall, if, required, by, the, comptroller, or, the, authority, be, secured, by, obligations, of, the, united, states, or, of, the, state, of, new, york, of, a, market, value, equal, at, all, times, to, the, amount, of, the, deposit, and, all, banks, and, trust, companies, are, authorized, to, give, such, security, for, such, deposits, the, comptroller, and, his, or, her, legally, authorized, representatives, shall, be, authorized, and, empowered, from, time, to, time, to, examine, the, accounts, and, books, of, the, authority, including, its, receipts, disbursements, contracts, leases, sinking, funds, investments, and, any, other, matters, relating, to, its, financial, standing	deposit, investment, monies, authority, moneys, whatever, source, derived, paid, comptroller, agent, commingle, deposited, separate, bank, account, accounts, check, requisition, chairperson, may, authorize, deposits, required, secured, obligations, united, states, state, new, york, market, value, equal, amount, banks, trust, companies, authorized, security, legally, representatives, empowered, examine, books, receipts, disbursements, contracts, leases, sinking, funds, investments, matters, relating, financial, standing	(§8.) TITLE 36 § 2799-ggggg.1.	56
859	2.	54.26 - 54.41	Notwithstanding the provisions of this section, the authority shall have power, subject to the approval of the comptroller, to contract with the holders of any of its notes or bonds as to the custody, collection, securing, investment and payment of any moneys of the authority, or any moneys held in trust or otherwise for the payment of notes or bonds or in any way to secure notes or bonds, and to carry out any such contract. Moneys held in trust or otherwise for the payment of notes or bonds or in any way to secure notes or bonds and deposits of such moneys may be secured in the same manner as moneys of the authority, and all banks and trust companies shall be authorized to give such security for such deposits. Moneys of the authority not required for immediate use may, in the discretion of the authority, be invested by the comptroller in obligations in which the comptroller may invest pursuant to section ninetyeight-a of the state finance law. Subject to agreements with noteholders and bondholders and the approval of the comptroller, the authority shall prescribe a system of accounts. 	notwithstanding, the, provisions, of, this, section, the, authority, shall, have, power, subject, to, the, approval, of, the, comptroller, to, contract, with, the, holders, of, any, of, its, notes, or, bonds, as, to, the, custody, collection, securing, investment, and, payment, of, any, moneys, of, the, authority, or, any, moneys, held, in, trust, or, otherwise, for, the, payment, of, notes, or, bonds, or, in, any, way, to, secure, notes, or, bonds, and, to, carry, out, any, such, contract, moneys, held, in, trust, or, otherwise, for, the, payment, of, notes, or, bonds, or, in, any, way, to, secure, notes, or, bonds, and, deposits, of, such, moneys, may, be, secured, in, the, same, manner, as, moneys, of, the, authority, and, all, banks, and, trust, companies, shall, be, authorized, to, give, such, security, for, such, deposits, moneys, of, the, authority, not, required, for, immediate, use, may, in, the, discretion, of, the, authority, be, invested, by, the, comptroller, in, obligations, in, which, the, comptroller, may, invest, pursuant, to, section, ninetyeight, a, of, the, state, finance, law, subject, to, agreements, with, noteholders, and, bondholders, and, the, approval, of, the, comptroller, the, authority, shall, prescribe, a, system, of, accounts	notwithstanding, provisions, authority, power, subject, approval, comptroller, contract, holders, notes, bonds, custody, collection, securing, investment, payment, moneys, held, trust, otherwise, secure, carry, deposits, may, secured, manner, banks, companies, authorized, security, required, immediate, discretion, invested, obligations, invest, pursuant, ninetyeight, state, finance, law, agreements, noteholders, bondholders, prescribe, system, accounts	(§8.) TITLE 36 § 2799-ggggg.2.	47
860	1.	54.42 - 54.52	Agreement of the state. 1. The state shall not limit or alter the rights hereby vested in the authority to establish and collect such fees, rentals and charges as may be convenient or necessary to produce sufficient revenue to meet the expense of maintenance and operation and to fulfill the terms of any agreements made with the holders of notes, bonds, or other obligations of the authority not guaranteed by the state, or in any way impair the rights and remedies of such holders until such notes, bonds, and other obligations, together with the interest thereon, with interest on any unpaid installments of interest, and all costs and expenses in connection with any action or proceedings by or on behalf of such holders, are fully met and discharged. 	agreement, of, the, state, 1, the, state, shall, not, limit, or, alter, the, rights, hereby, vested, in, the, authority, to, establish, and, collect, such, fees, rentals, and, charges, as, may, be, convenient, or, necessary, to, produce, sufficient, revenue, to, meet, the, expense, of, maintenance, and, operation, and, to, fulfill, the, terms, of, any, agreements, made, with, the, holders, of, notes, bonds, or, other, obligations, of, the, authority, not, guaranteed, by, the, state, or, in, any, way, impair, the, rights, and, remedies, of, such, holders, until, such, notes, bonds, and, other, obligations, together, with, the, interest, thereon, with, interest, on, any, unpaid, installments, of, interest, and, all, costs, and, expenses, in, connection, with, any, action, or, proceedings, by, or, on, behalf, of, such, holders, are, fully, met, and, discharged	agreement, state, limit, alter, rights, hereby, vested, authority, establish, collect, fees, rentals, charges, may, convenient, necessary, produce, sufficient, revenue, expense, maintenance, operation, fulfill, terms, agreements, holders, notes, bonds, obligations, guaranteed, impair, remedies, interest, thereon, unpaid, installments, costs, expenses, connection, action, proceedings, behalf, fully, met, discharged	(§8.) TITLE 36 § 2799-hhhhh.1.	45
861	2.	54.53 - 55.2	The state shall pledge to and agree with the holders of any notes or bonds of the authority, not guaranteed by the state, secured by a pledge of the fees or other revenues or any part thereof so long as the obligations of such bonds for principal and interest shall not have been paid or otherwise discharged; 	the, state, shall, pledge, to, and, agree, with, the, holders, of, any, notes, or, bonds, of, the, authority, not, guaranteed, by, the, state, secured, by, a, pledge, of, the, fees, or, other, revenues, or, any, part, thereof, so, long, as, the, obligations, of, such, bonds, for, principal, and, interest, shall, not, have, been, paid, or, otherwise, discharged	state, pledge, agree, holders, notes, bonds, authority, guaranteed, secured, fees, revenues, thereof, obligations, principal, interest, paid, otherwise, discharged	(§8.) TITLE 36 § 2799-hhhhh.2.	18
862	3.	55.3 - 55.5	Nothing in this title shall be construed as diminishing or enlarging any valid existing rights under any license heretofore issued pursuant to the provisions of the federal power act. 	nothing, in, this, title, shall, be, construed, as, diminishing, or, enlarging, any, valid, existing, rights, under, any, license, heretofore, issued, pursuant, to, the, provisions, of, the, federal, power, act	nothing, title, construed, diminishing, enlarging, valid, existing, rights, license, heretofore, issued, pursuant, provisions, federal, power, act	(§8.) TITLE 36 § 2799-hhhhh.3.	16
863	1.	55.6 - 55.11	Exemption from taxation. 1. The operation of the authority shall be primarily for the benefit of the people of the state of New York, for the improvement of their health, welfare and prosperity, and is a public purpose, and the authority shall be regarded as performing an essential governmental function in carrying out the provisions of this title. 	exemption, from, taxation, 1, the, operation, of, the, authority, shall, be, primarily, for, the, benefit, of, the, people, of, the, state, of, new, york, for, the, improvement, of, their, health, welfare, and, prosperity, and, is, a, public, purpose, and, the, authority, shall, be, regarded, as, performing, an, essential, governmental, function, in, carrying, out, the, provisions, of, this, title	exemption, taxation, operation, authority, primarily, benefit, state, new, york, improvement, health, welfare, prosperity, public, purpose, regarded, performing, essential, governmental, function, carrying, provisions, title	(§8.) TITLE 36 § 2799-iiiii.1.	23
864	2.	55.12 - 55.13	The property of the authority and its income and operations shall be exempt from taxation. 	the, property, of, the, authority, and, its, income, and, operations, shall, be, exempt, from, taxation	property, authority, income, operations, exempt, taxation	(§8.) TITLE 36 § 2799-iiiii.2.	6
865	§ 2799-jjjjj.	55.14 - 55.22	Tax covenant. The tax covenants with the purchasers and with all subsequent holders and transferees of notes and bonds issued by the authority, in consideration of the acceptance of and payment for the notes and bonds, that the notes and bonds of the authority issued pursuant to this title and the income therefrom and all its fees, charges, rents, gifts, grants, revenues, receipts and other moneys received or to be received, pledged to pay or secure the payment of such notes or bonds shall at all times be free from taxation except for estate or gift taxes and taxes on transfers. 	tax, covenant, the, tax, covenants, with, the, purchasers, and, with, all, subsequent, holders, and, transferees, of, notes, and, bonds, issued, by, the, authority, in, consideration, of, the, acceptance, of, and, payment, for, the, notes, and, bonds, that, the, notes, and, bonds, of, the, authority, issued, pursuant, to, this, title, and, the, income, therefrom, and, all, its, fees, charges, rents, gifts, grants, revenues, receipts, and, other, moneys, received, or, to, be, received, pledged, to, pay, or, secure, the, payment, of, such, notes, or, bonds, shall, at, all, times, be, free, from, taxation, except, for, estate, or, gift, taxes, and, taxes, on, transfers	tax, covenant, covenants, purchasers, subsequent, holders, transferees, notes, bonds, issued, authority, consideration, acceptance, payment, pursuant, title, income, therefrom, fees, charges, rents, grants, revenues, receipts, moneys, pledged, secure, taxation, except, estate, gift, taxes, transfers	(§8.) TITLE 36 § 2799-jjjjj.	33
866	§ 2799-kkkkk.	55.23 - 55.31	Repayment of state appropriations. All appropriations made by the state to the authority shall be treated as advances by the state to the authority, and shall be repaid to it without interest either out of the proceeds of bonds issued by the authority pursuant to the provisions of this title, or by the delivery of non-interest bearing bonds of the authority to the state for all or any part of such advances, or out of excess revenues of the authority, at such times and on such conditions as the state and the authority may mutually agree upon. 	repayment, of, state, appropriations, all, appropriations, made, by, the, state, to, the, authority, shall, be, treated, as, advances, by, the, state, to, the, authority, and, shall, be, repaid, to, it, without, interest, either, out, of, the, proceeds, of, bonds, issued, by, the, authority, pursuant, to, the, provisions, of, this, title, or, by, the, delivery, of, non, interest, bearing, bonds, of, the, authority, to, the, state, for, all, or, any, part, of, such, advances, or, out, of, excess, revenues, of, the, authority, at, such, times, and, on, such, conditions, as, the, state, and, the, authority, may, mutually, agree, upon	repayment, state, appropriations, authority, treated, advances, repaid, interest, proceeds, bonds, issued, pursuant, provisions, title, delivery, bearing, excess, revenues, conditions, may, mutually, agree	(§8.) TITLE 36 § 2799-kkkkk.	22
867	1.	55.32 - 55.36	Equal employment opportunity and minority and womenowned business enterprise programs. 1. All contracts entered into by the authority pursuant to this title of whatever nature and all documents soliciting bids or proposals therefor shall contain or make reference to the following provisions: 	equal, employment, opportunity, and, minority, and, womenowned, business, enterprise, programs, 1, all, contracts, entered, into, by, the, authority, pursuant, to, this, title, of, whatever, nature, and, all, documents, soliciting, bids, or, proposals, therefor, shall, contain, or, make, reference, to, the, following, provisions	equal, employment, opportunity, minority, womenowned, business, enterprise, programs, contracts, entered, authority, pursuant, title, whatever, nature, documents, soliciting, bids, proposals, therefor, contain, reference, provisions	(§8.) TITLE 36 § 2799-lllll.1.	23
868	(a)	55.37 - 55.48	The contractor shall not discriminate against employees or applicants for employment because of race, creed, color, national origin, sex, age, disability, marital status, sexual orientation, gender identity or expression, familial status, predisposing genetic characteristics, military status, or status as a victim of domestic violence and shall undertake or continue existing programs of affirmative action to ensure that minority group persons and women are afforded equal opportunity without discrimination. Such programs shall include, but not be limited to, recruitment, employment, job assignment, promotion, upgrading, demotion, transfer, layoff, termination, rates of pay or other forms of compensation, and selection for training and retraining, including apprenticeship and on-the-job training; 	the, contractor, shall, not, discriminate, against, employees, or, applicants, for, employment, because, of, race, creed, color, national, origin, sex, age, disability, marital, status, sexual, orientation, gender, identity, or, expression, familial, status, predisposing, genetic, characteristics, military, status, or, status, as, a, victim, of, domestic, violence, and, shall, undertake, or, continue, existing, programs, of, affirmative, action, to, ensure, that, minority, group, persons, and, women, are, afforded, equal, opportunity, without, discrimination, such, programs, shall, include, but, not, be, limited, to, recruitment, employment, job, assignment, promotion, upgrading, demotion, transfer, layoff, termination, rates, of, pay, or, other, forms, of, compensation, and, selection, for, training, and, retraining, including, apprenticeship, and, on, the, job, training	contractor, discriminate, employees, applicants, employment, race, creed, national, origin, sex, disability, marital, status, sexual, orientation, gender, identity, expression, familial, predisposing, genetic, characteristics, military, victim, domestic, violence, undertake, continue, existing, programs, affirmative, action, ensure, minority, group, persons, women, afforded, equal, opportunity, discrimination, limited, recruitment, job, assignment, promotion, upgrading, demotion, transfer, layoff, termination, rates, forms, compensation, selection, training, retraining, apprenticeship	(§8.) TITLE 36 § 2799-lllll.1.(a)	58
869	(b)	55.49 - 56.4	At the request of the authority, the contractor shall request each employment agency, labor union, or authorized representative of workers with which it has a collective bargaining or other agreement or understanding and which is involved in the performance of the contract with the authority to furnish a written statement that such employment agency, labor union or representative shall not discriminate because of race, creed, color, national origin, sex, age, disability, marital status, sexual orientation, gender identity or expression, familial status, predisposing genetic characteristics, military status, or status as a victim of domestic violence and that such union or representative shall cooperate in the implementation of the contractor's obligations under this paragraph; 	at, the, request, of, the, authority, the, contractor, shall, request, each, employment, agency, labor, union, or, authorized, representative, of, workers, with, which, it, has, a, collective, bargaining, or, other, agreement, or, understanding, and, which, is, involved, in, the, performance, of, the, contract, with, the, authority, to, furnish, a, written, statement, that, such, employment, agency, labor, union, or, representative, shall, not, discriminate, because, of, race, creed, color, national, origin, sex, age, disability, marital, status, sexual, orientation, gender, identity, or, expression, familial, status, predisposing, genetic, characteristics, military, status, or, status, as, a, victim, of, domestic, violence, and, that, such, union, or, representative, shall, cooperate, in, the, implementation, of, the, contractor's, obligations, under, this, paragraph	request, authority, contractor, employment, agency, labor, union, authorized, representative, workers, collective, bargaining, agreement, understanding, involved, performance, contract, furnish, statement, discriminate, race, creed, national, origin, sex, disability, marital, status, sexual, orientation, gender, identity, expression, familial, predisposing, genetic, characteristics, military, victim, domestic, violence, cooperate, implementation, contractor's, obligations, paragraph	(§8.) TITLE 36 § 2799-lllll.1.(b)	46
