Item	Outline	Page_Lines	Text	Tokens	Keywords	Tag	Number_of_Keywords
1	Section 1.	1.1 - 1.2	"Short title. This act shall be known and may be cited as the ""climate and community investment act"". "	short, title, this, act, shall, be, known, and, may, be, cited, as, the, climate, and, community, investment, act	title, act, known, may, cited, climate, community, investment	§ 1.	8
2	§ 2.	1.3 - 1.4	Legislative findings and declaration. The legislature finds and declares that: 	legislative, findings, and, declaration, the, legislature, finds, and, declares, that	legislative, findings, declaration, legislature, finds, declares	§ 2.	6
3	1.	1.5 - 1.7	Climate change is adversely affecting economic well-being, public health, natural resources, and the environment of New York. The adverse impacts of climate change include: 	climate, change, is, adversely, affecting, economic, well, being, public, health, natural, resources, and, the, environment, of, new, york, the, adverse, impacts, of, climate, change, include	climate, adversely, affecting, economic, public, health, natural, resources, environment, new, york, adverse, impacts	§ 2.1.	13
4	(a)	1.8 - 1.11	an increase in the severity and frequency of extreme weather events, such as storms, flooding, and heat waves, which can cause direct injury or death, property damage, and ecological damage (e.g., through the release of hazardous substances into the environment); 	an, increase, in, the, severity, and, frequency, of, extreme, weather, events, such, as, storms, flooding, and, heat, waves, which, can, cause, direct, injury, or, death, property, damage, and, ecological, damage, e.g, through, the, release, of, hazardous, substances, into, the, environment	increase, severity, frequency, extreme, weather, events, storms, flooding, heat, waves, cause, direct, injury, death, property, damage, ecological, e.g, release, hazardous, substances, environment	§ 2.1.(a)	22
5	(b)	1.12 - 1.15	rising sea levels, which exacerbate damage from storm surges and flooding, contribute to coastal erosion and saltwater intrusion, and inundate low-lying areas, leading to the displacement of or damage to coastal habitat, property, and infrastructure; 	rising, sea, levels, which, exacerbate, damage, from, storm, surges, and, flooding, contribute, to, coastal, erosion, and, saltwater, intrusion, and, inundate, low, lying, areas, leading, to, the, displacement, of, or, damage, to, coastal, habitat, property, and, infrastructure	rising, sea, levels, exacerbate, damage, storm, surges, flooding, contribute, coastal, erosion, saltwater, intrusion, inundate, lying, areas, leading, displacement, habitat, property, infrastructure	§ 2.1.(b)	21
6	(c)	1.16 - 1.16	exacerbation of air pollution; 	exacerbation, of, air, pollution	exacerbation, air, pollution	§ 2.1.(c)	3
7	(d)	1.17 - 1.18	an increase in the incidences of infectious diseases, asthma attacks, heart attacks, and other negative health outcomes; 	an, increase, in, the, incidences, of, infectious, diseases, asthma, attacks, heart, attacks, and, other, negative, health, outcomes	increase, incidences, infectious, diseases, asthma, attacks, heart, negative, health, outcomes	§ 2.1.(d)	10
8	(e)	1.19 - 1.20	increased average temperatures, which increase the demand for air conditioning and refrigeration among residents and businesses; and 	increased, average, temperatures, which, increase, the, demand, for, air, conditioning, and, refrigeration, among, residents, and, businesses, and	increased, average, temperatures, increase, demand, air, conditioning, refrigeration, residents, businesses	§ 2.1.(e)	10
9	(f)	2.1 - 2.2	extensive environmental degradation with devastating impacts to wildlife and natural habitats, ecosystems and food supplies. 	extensive, environmental, degradation, with, devastating, impacts, to, wildlife, and, natural, habitats, ecosystems, and, food, supplies	extensive, environmental, degradation, devastating, impacts, wildlife, natural, habitats, ecosystems, food, supplies	§ 2.1.(f)	11
10	2.	2.3 - 2.11	Many of the impacts of climate change are already observable in New York state and the northeastern United States. Annual average temperatures are on the rise, winter snow cover is decreasing, heat waves and precipitation are intensifying, and sea levels along New York's coastline are approximately one foot higher than they were in 1900. New York has also experienced an increasing number of extreme and unusual weather events, like Hurricanes Irene and Lee and the unprecedented Superstorm Sandy in 2012, which caused at least 53 deaths and $32 billion in damage in New York state. 	many, of, the, impacts, of, climate, change, are, already, observable, in, new, york, state, and, the, northeastern, united, states, annual, average, temperatures, are, on, the, rise, winter, snow, cover, is, decreasing, heat, waves, and, precipitation, are, intensifying, and, sea, levels, along, new, york's, coastline, are, approximately, one, foot, higher, than, they, were, in, 1900, new, york, has, also, experienced, an, increasing, number, of, extreme, and, unusual, weather, events, like, hurricanes, irene, and, lee, and, the, unprecedented, superstorm, sandy, in, 2012, which, caused, at, least, 53, deaths, and, 32, billion, in, damage, in, new, york, state	impacts, climate, observable, new, york, state, northeastern, united, states, annual, average, temperatures, rise, winter, snow, cover, decreasing, heat, waves, precipitation, intensifying, sea, levels, york's, coastline, approximately, foot, experienced, increasing, number, extreme, unusual, weather, events, hurricanes, irene, lee, unprecedented, superstorm, sandy, caused, deaths, billion, damage	§ 2.2.	44
11	3.	2.12 - 2.16	New York should therefore minimize the risks associated with climate change through a combination of measures to reduce statewide greenhouse gas emissions and improve the resiliency of the state with respect to the impacts and risks of climate change that cannot be avoided. 	new, york, should, therefore, minimize, the, risks, associated, with, climate, change, through, a, combination, of, measures, to, reduce, statewide, greenhouse, gas, emissions, and, improve, the, resiliency, of, the, state, with, respect, to, the, impacts, and, risks, of, climate, change, that, cannot, be, avoided	new, york, therefore, minimize, risks, associated, climate, combination, measures, reduce, statewide, greenhouse, gas, emissions, improve, resiliency, state, respect, impacts, cannot, avoided	§ 2.3.	21
12	4.	2.17 - 2.24	Climate change especially heightens the vulnerability of disadvantaged communities, including communities of color and low-income communities, which bear environmental and socioeconomic burdens as well as legacies of racial and ethnic discrimination. Disadvantaged communities are more likely to experience flooding and urban heat island effects, and to live in housing vulnerable to destruction from storms. Low-income New Yorkers lack emergency savings to keep up with necessary expenses following the disruption from a major storm or climate event. 	climate, change, especially, heightens, the, vulnerability, of, disadvantaged, communities, including, communities, of, color, and, low, income, communities, which, bear, environmental, and, socioeconomic, burdens, as, well, as, legacies, of, racial, and, ethnic, discrimination, disadvantaged, communities, are, more, likely, to, experience, flooding, and, urban, heat, island, effects, and, to, live, in, housing, vulnerable, to, destruction, from, storms, low, income, new, yorkers, lack, emergency, savings, to, keep, up, with, necessary, expenses, following, the, disruption, from, a, major, storm, or, climate, event	climate, especially, heightens, vulnerability, disadvantaged, communities, income, bear, environmental, socioeconomic, burdens, legacies, racial, ethnic, discrimination, likely, experience, flooding, urban, heat, island, effects, live, housing, vulnerable, destruction, storms, new, yorkers, lack, emergency, savings, necessary, expenses, disruption, major, storm, event	§ 2.4.	38
13	5.	2.25 - 2.31	Actions taken by New York state to reduce greenhouse gas emissions, and those taken to increase the resiliency of the state with respect to the impacts and risks of climate change, should prioritize the safety, health, and resiliency of disadvantaged communities, control potential regressive impacts of future climate change mitigation and adaptation policies on these communities, and prioritize the allocation of public investments in these areas. 	actions, taken, by, new, york, state, to, reduce, greenhouse, gas, emissions, and, those, taken, to, increase, the, resiliency, of, the, state, with, respect, to, the, impacts, and, risks, of, climate, change, should, prioritize, the, safety, health, and, resiliency, of, disadvantaged, communities, control, potential, regressive, impacts, of, future, climate, change, mitigation, and, adaptation, policies, on, these, communities, and, prioritize, the, allocation, of, public, investments, in, these, areas	actions, new, york, state, reduce, greenhouse, gas, emissions, increase, resiliency, respect, impacts, risks, climate, prioritize, safety, health, disadvantaged, communities, control, potential, regressive, future, mitigation, adaptation, policies, allocation, public, investments, areas	§ 2.5.	30
14	6.	2.32 - 2.35	Disadvantaged communities in New York state experience greater exposure to air pollution and subsequent negative health impacts, in large part due to legacies of racial, ethnic, and socio-economic discrimination. New York's communities of color are more likely to: 	disadvantaged, communities, in, new, york, state, experience, greater, exposure, to, air, pollution, and, subsequent, negative, health, impacts, in, large, part, due, to, legacies, of, racial, ethnic, and, socio, economic, discrimination, new, york's, communities, of, color, are, more, likely, to	disadvantaged, communities, new, york, state, experience, greater, exposure, air, pollution, subsequent, negative, health, impacts, legacies, racial, ethnic, socio, economic, discrimination, york's, likely	§ 2.6.	22
15	(a)	2.36 - 2.38	live near sites of high pollution, including power plants, highly trafficked automotive routes, waste transfer stations,        landfills, hazardous waste sites and toxic industrial facilities; 	live, near, sites, of, high, pollution, including, power, plants, highly, trafficked, automotive, routes, waste, transfer, stations, landfills, hazardous, waste, sites, and, toxic, industrial, facilities	live, near, sites, pollution, power, plants, highly, trafficked, automotive, routes, waste, transfer, stations, landfills, hazardous, toxic, industrial, facilities	§ 2.6.(a)	18
16	(b)	2.39 - 2.40	breathe in a greater volume of pollution, including both ozone and particulate matter; 	breathe, in, a, greater, volume, of, pollution, including, both, ozone, and, particulate, matter	breathe, greater, volume, pollution, ozone, particulate, matter	§ 2.6.(b)	7
17	(c)	2.41 - 2.42	experience asthma and other pollution-related illnesses including increased hospitalization rates for childhood asthma; 	experience, asthma, and, other, pollution, related, illnesses, including, increased, hospitalization, rates, for, childhood, asthma	experience, asthma, pollution, related, illnesses, increased, hospitalization, rates, childhood	§ 2.6.(c)	9
18	(d)	2.43 - 2.45	have higher rates of cancer due to disproportionate exposure to air pollution, including lung cancer and other pollution-affiliated cancers; and 	have, higher, rates, of, cancer, due, to, disproportionate, exposure, to, air, pollution, including, lung, cancer, and, other, pollution, affiliated, cancers, and	rates, cancer, disproportionate, exposure, air, pollution, lung, affiliated, cancers	§ 2.6.(d)	9
19	(e)	2.46 - 2.49	experience other negative health impacts, including but not limited to reduced fertility rates, adverse pregnancy outcomes and increased vulnerability to the consequences of co-morbidities like diabetes and high blood pressure. 	experience, other, negative, health, impacts, including, but, not, limited, to, reduced, fertility, rates, adverse, pregnancy, outcomes, and, increased, vulnerability, to, the, consequences, of, co, morbidities, like, diabetes, and, high, blood, pressure	experience, negative, health, impacts, limited, reduced, fertility, rates, adverse, pregnancy, outcomes, increased, vulnerability, consequences, morbidities, diabetes, blood, pressure	§ 2.6.(e)	18
20	7.	2.50 - 3.2	In the spring of 2020, New York experienced the devastating impacts of the Covid-19 pandemic. Tens of thousands of New Yorkers died, and many hundreds of thousands more became ill. Air pollution played a significant role in this pandemic, as residents of communities of color who live in highly polluted areas died disproportionately from Covid-19 when compared to patients from less polluted neighborhoods. Throughout the pandemic, New Yorkers of color continue to disproportionately contract, fall ill, and die from Covid-19, in part because of disproportionate exposure to toxic air pollution. 	in, the, spring, of, 2020, new, york, experienced, the, devastating, impacts, of, the, covid, 19, pandemic, tens, of, thousands, of, new, yorkers, died, and, many, hundreds, of, thousands, more, became, ill, air, pollution, played, a, significant, role, in, this, pandemic, as, residents, of, communities, of, color, who, live, in, highly, polluted, areas, died, disproportionately, from, covid, 19, when, compared, to, patients, from, less, polluted, neighborhoods, throughout, the, pandemic, new, yorkers, of, color, continue, to, disproportionately, contract, fall, ill, and, die, from, covid, 19, in, part, because, of, disproportionate, exposure, to, toxic, air, pollution	spring, new, york, experienced, devastating, impacts, covid, pandemic, tens, thousands, yorkers, died, hundreds, became, ill, air, pollution, played, significant, role, residents, communities, live, highly, polluted, areas, disproportionately, compared, patients, neighborhoods, throughout, continue, contract, fall, die, disproportionate, exposure, toxic	§ 2.7.	38
21	8.	3.3 - 3.13	The Covid-19 pandemic has also caused a national economic crisis which has also severely impacted New York State. Many New Yorkers lost their jobs during the Covid-19 pandemic, with unemployment rates reaching levels not seen since the Great Depression. Such mass job loss increased precarity for thousands of New Yorkers and left many less able to weather current or future emergencies. Child and dependent care shortages are and continue to be a barrier to work in New York, especially for women, who disproportionately take on unpaid caregiving responsibilities when their family cannot find or afford child and dependent care. Low and middle-income families and families of color disproportionately lack access to quality child and dependent care. 	the, covid, 19, pandemic, has, also, caused, a, national, economic, crisis, which, has, also, severely, impacted, new, york, state, many, new, yorkers, lost, their, jobs, during, the, covid, 19, pandemic, with, unemployment, rates, reaching, levels, not, seen, since, the, great, depression, such, mass, job, loss, increased, precarity, for, thousands, of, new, yorkers, and, left, many, less, able, to, weather, current, or, future, emergencies, child, and, dependent, care, shortages, are, and, continue, to, be, a, barrier, to, work, in, new, york, especially, for, women, who, disproportionately, take, on, unpaid, caregiving, responsibilities, when, their, family, cannot, find, or, afford, child, and, dependent, care, low, and, middle, income, families, and, families, of, color, disproportionately, lack, access, to, quality, child, and, dependent, care	covid, pandemic, caused, national, economic, crisis, severely, impacted, new, york, state, yorkers, lost, jobs, unemployment, rates, reaching, levels, seen, depression, mass, job, loss, increased, precarity, thousands, weather, future, emergencies, child, dependent, shortages, continue, barrier, work, especially, women, disproportionately, unpaid, caregiving, responsibilities, family, cannot, afford, middle, income, families, lack, access, quality	§ 2.8.	50
22	9.	3.14 - 3.26	New York state has an interest in reducing air pollution that increases risk for Covid-19 and ensuring that all populations are equally able to breathe clean air and live healthful lives. Actions undertaken by New York to reduce air pollution should prioritize the health and safety of disadvantaged communities, prioritize the allocation of public investments in these areas, and control potential regressive impacts of climate policies on these communities. Further, it is in the interest of the state to invest in creating stable and safe employment opportunities for individuals who have lost their jobs as part of the Covid-19 recession. This includes protecting and promoting the ability for all workers to equitably participate in a just clean energy transition by increasing equitable and comprehensive access to child and dependent care. 	new, york, state, has, an, interest, in, reducing, air, pollution, that, increases, risk, for, covid, 19, and, ensuring, that, all, populations, are, equally, able, to, breathe, clean, air, and, live, healthful, lives, actions, undertaken, by, new, york, to, reduce, air, pollution, should, prioritize, the, health, and, safety, of, disadvantaged, communities, prioritize, the, allocation, of, public, investments, in, these, areas, and, control, potential, regressive, impacts, of, climate, policies, on, these, communities, further, it, is, in, the, interest, of, the, state, to, invest, in, creating, stable, and, safe, employment, opportunities, for, individuals, who, have, lost, their, jobs, as, part, of, the, covid, 19, recession, this, includes, protecting, and, promoting, the, ability, for, all, workers, to, equitably, participate, in, a, just, clean, energy, transition, by, increasing, equitable, and, comprehensive, access, to, child, and, dependent, care	new, york, state, interest, reducing, air, pollution, increases, risk, covid, ensuring, populations, equally, breathe, clean, live, healthful, lives, actions, undertaken, reduce, prioritize, health, safety, disadvantaged, communities, allocation, public, investments, areas, control, potential, regressive, impacts, climate, policies, invest, creating, stable, safe, employment, opportunities, individuals, lost, jobs, recession, protecting, promoting, ability, workers, equitably, participate, energy, transition, increasing, equitable, comprehensive, access, child, dependent	§ 2.9.	60
23	10.	3.27 - 3.35	Racial justice and environmental justice are inextricably linked to achieving a just clean energy transition in New York. The murder of George Floyd on May 25, 2020 was followed by mass protests for Black lives in New York state and throughout the nation. These movements have forced a national reckoning with the fact that racial injustice has resulted in over-policing and mass incarceration of communities of color. It is in the interest of the state of New York that no funds from programs for pricing greenhouse gas emissions are invested in police, prisons or related infrastructure. 	racial, justice, and, environmental, justice, are, inextricably, linked, to, achieving, a, just, clean, energy, transition, in, new, york, the, murder, of, george, floyd, on, may, 25, 2020, was, followed, by, mass, protests, for, black, lives, in, new, york, state, and, throughout, the, nation, these, movements, have, forced, a, national, reckoning, with, the, fact, that, racial, injustice, has, resulted, in, over, policing, and, mass, incarceration, of, communities, of, color, it, is, in, the, interest, of, the, state, of, new, york, that, no, funds, from, programs, for, pricing, greenhouse, gas, emissions, are, invested, in, police, prisons, or, related, infrastructure	racial, justice, environmental, inextricably, linked, achieving, clean, energy, transition, new, york, murder, george, floyd, may, followed, mass, protests, black, lives, state, throughout, nation, movements, forced, national, reckoning, injustice, resulted, policing, incarceration, communities, interest, funds, programs, pricing, greenhouse, gas, emissions, invested, police, prisons, related, infrastructure	§ 2.10.	44
24	11.	3.36 - 3.42	The adverse impacts of climate change are having a detrimental effect on some of New York's largest industries, including agriculture, commercial shipping, forestry, tourism, and recreational and commercial fishing. These impacts also place additional strain on the physical infrastructure that delivers critical services to the citizens of New York, including the state's energy, transportation, stormwater, and wastewater infrastructure. 	the, adverse, impacts, of, climate, change, are, having, a, detrimental, effect, on, some, of, new, york's, largest, industries, including, agriculture, commercial, shipping, forestry, tourism, and, recreational, and, commercial, fishing, these, impacts, also, place, additional, strain, on, the, physical, infrastructure, that, delivers, critical, services, to, the, citizens, of, new, york, including, the, state's, energy, transportation, stormwater, and, wastewater, infrastructure	adverse, impacts, climate, detrimental, effect, new, york's, largest, industries, agriculture, commercial, shipping, forestry, tourism, recreational, fishing, strain, physical, infrastructure, delivers, critical, services, citizens, york, state's, energy, transportation, stormwater, wastewater	§ 2.11.	29
25	12.	3.43 - 3.49	Creating good jobs and a thriving economy is a core concern of New York state. Shaping the ongoing transition in our energy sector to ensure that it creates good jobs and protects workers and communities that may lose employment in the current transition must be key concerns of our climate policy. Setting clear standards for job quality and training standards encourages not only high-quality work but positive economic impacts. 	creating, good, jobs, and, a, thriving, economy, is, a, core, concern, of, new, york, state, shaping, the, ongoing, transition, in, our, energy, sector, to, ensure, that, it, creates, good, jobs, and, protects, workers, and, communities, that, may, lose, employment, in, the, current, transition, must, be, key, concerns, of, our, climate, policy, setting, clear, standards, for, job, quality, and, training, standards, encourages, not, only, high, quality, work, but, positive, economic, impacts	creating, jobs, thriving, economy, core, concern, new, york, state, shaping, ongoing, transition, energy, sector, ensure, creates, protects, workers, communities, may, lose, employment, concerns, climate, policy, setting, standards, job, quality, training, encourages, work, positive, economic, impacts	§ 2.12.	35
26	13.	3.50 - 4.6	Ensuring career opportunities are created and shared geographically and demographically is necessary to ensure increased access to good jobs for marginalized communities while making the same neighborhoods more resilient. Climate change has a disproportionate impact on low-income people, communities of color, women, youth, children and workers. This includes formerly incarcerated individuals. Disadvantaged communities and workers must have access to all aspects of the state's clean energy economy, including as investors and developers of clean energy projects.     It is in the interest of the state of New York to protect and promote the interests of these groups against the impacts of climate change and severe weather events and to advance our equity goals by ensuring quality employment opportunities in safe working environments. 	ensuring, career, opportunities, are, created, and, shared, geographically, and, demographically, is, necessary, to, ensure, increased, access, to, good, jobs, for, marginalized, communities, while, making, the, same, neighborhoods, more, resilient, climate, change, has, a, disproportionate, impact, on, low, income, people, communities, of, color, women, youth, children, and, workers, this, includes, formerly, incarcerated, individuals, disadvantaged, communities, and, workers, must, have, access, to, all, aspects, of, the, state's, clean, energy, economy, including, as, investors, and, developers, of, clean, energy, projects, it, is, in, the, interest, of, the, state, of, new, york, to, protect, and, promote, the, interests, of, these, groups, against, the, impacts, of, climate, change, and, severe, weather, events, and, to, advance, our, equity, goals, by, ensuring, quality, employment, opportunities, in, safe, working, environments	ensuring, career, opportunities, shared, geographically, demographically, necessary, ensure, increased, access, jobs, marginalized, communities, neighborhoods, resilient, climate, disproportionate, impact, income, women, youth, children, workers, formerly, incarcerated, individuals, disadvantaged, aspects, state's, clean, energy, economy, investors, developers, projects, interest, state, new, york, protect, promote, interests, impacts, severe, weather, events, advance, equity, goals, quality, employment, safe, working, environments	§ 2.13.	54
