Item	Outline	Page_Lines	Text	Tokens	Keywords	Tag	Number_of_Keywords
275	3.	19.51 - 19.52	Application process. This section shall apply to all contracts as defined in this section. 	application, process, this, section, shall, apply, to, all, contracts, as, defined, in, this, section	application, process, apply, contracts, defined	(§5.) ARTICLE 8-B § 229-b.3.	5
276	(a)	19.53 - 19.54	in awarding contracts under this section, awarding authorities shall utilize the best-value framework for contracts. 	in, awarding, contracts, under, this, section, awarding, authorities, shall, utilize, the, best, value, framework, for, contracts	awarding, contracts, authorities, utilize, value, framework	(§5.) ARTICLE 8-B § 229-b.3.(a)	6
277	(b)	19.55 - 20.2	awarding authorities shall develop a system for awarding extra points and/or credit for those proposers that create and submit a local employment plan or U.S. employment plan (depending on source of funding). 	awarding, authorities, shall, develop, a, system, for, awarding, extra, points, and, or, credit, for, those, proposers, that, create, and, submit, a, local, employment, plan, or, u.s, employment, plan, depending, on, source, of, funding	awarding, authorities, develop, system, extra, credit, proposers, submit, local, employment, plan, u.s, depending, source, funding	(§5.) ARTICLE 8-B § 229-b.3.(b)	15
278	(c)	20.3 - 20.10	final contracts with a local employment plan and/or U.S. employment plan that are awarded under this section shall require vendors to submit quarterly reports within the first year of award and annual reports for subsequent years demonstrating vendor and subvendor compliance with their local employment plan and/or U.S. employment plan. These quarterly and annual reports shall be certified under penalty of perjury and must be submitted in order to receive milestone payments under the contract. 	final, contracts, with, a, local, employment, plan, and, or, u.s, employment, plan, that, are, awarded, under, this, section, shall, require, vendors, to, submit, quarterly, reports, within, the, first, year, of, award, and, annual, reports, for, subsequent, years, demonstrating, vendor, and, subvendor, compliance, with, their, local, employment, plan, and, or, u.s, employment, plan, these, quarterly, and, annual, reports, shall, be, certified, under, penalty, of, perjury, and, must, be, submitted, in, order, to, receive, milestone, payments, under, the, contract	final, contracts, local, employment, plan, u.s, awarded, require, vendors, submit, quarterly, reports, award, annual, subsequent, years, demonstrating, vendor, subvendor, compliance, certified, penalty, perjury, submitted, order, milestone, payments, contract	(§5.) ARTICLE 8-B § 229-b.3.(c)	28
279	(d)	20.11 - 20.16	requests for proposals under this section shall specify that terms and conditions of employment and compliance reports under the local employment plan and/or U.S. employment plan are not exempt from disclosure under the freedom of information law. Quarterly and subsequent annual reports related to contract fulfillment will be shared online on the awarding authority's web site. 	requests, for, proposals, under, this, section, shall, specify, that, terms, and, conditions, of, employment, and, compliance, reports, under, the, local, employment, plan, and, or, u.s, employment, plan, are, not, exempt, from, disclosure, under, the, freedom, of, information, law, quarterly, and, subsequent, annual, reports, related, to, contract, fulfillment, will, be, shared, online, on, the, awarding, authority's, web, site	requests, proposals, specify, terms, conditions, employment, compliance, reports, local, plan, u.s, exempt, disclosure, freedom, information, law, quarterly, subsequent, annual, related, contract, fulfillment, shared, online, awarding, authority's	(§5.) ARTICLE 8-B § 229-b.3.(d)	26
280	(e)	20.17 - 20.20	the awarding authority shall enact regulations creating forms for completion of the local employment plan and/or U.S. employment plan that the awarding authority will include with requests for proposals for contracts. 	the, awarding, authority, shall, enact, regulations, creating, forms, for, completion, of, the, local, employment, plan, and, or, u.s, employment, plan, that, the, awarding, authority, will, include, with, requests, for, proposals, for, contracts	awarding, authority, enact, regulations, creating, forms, completion, local, employment, plan, u.s, requests, proposals, contracts	(§5.) ARTICLE 8-B § 229-b.3.(e)	14
281	§ 6.	20.21 - 20.22	Section 231 of the labor law is amended by adding a new subdivision 8 to read as follows: 	section, 231, of, the, labor, law, is, amended, by, adding, a, new, subdivision, 8, to, read, as, follows	labor, law, amended, adding, new, subdivision, follows	§ 6.	7
282	8.	20.23 - 20.34	Building service employees employed in any building or facility that has received grants or tax abatements or exemptions or other assistance with a total present financial value of one million dollars or more for the increase of energy efficiency, building electrification upgrades, the development of renewable energies, or climate change resiliency shall be paid not less than the prevailing wage. Employers engaged in the provision of building service work shall be subject to all the reporting and compliance requirements of this article, including the right to maintain an action for the difference between the prevailing wages and the wages actually received. The prevailing wage requirement shall apply for the duration of the assistance or ten years after the project opens, whichever is longer. 	building, service, employees, employed, in, any, building, or, facility, that, has, received, grants, or, tax, abatements, or, exemptions, or, other, assistance, with, a, total, present, financial, value, of, one, million, dollars, or, more, for, the, increase, of, energy, efficiency, building, electrification, upgrades, the, development, of, renewable, energies, or, climate, change, resiliency, shall, be, paid, not, less, than, the, prevailing, wage, employers, engaged, in, the, provision, of, building, service, work, shall, be, subject, to, all, the, reporting, and, compliance, requirements, of, this, article, including, the, right, to, maintain, an, action, for, the, difference, between, the, prevailing, wages, and, the, wages, actually, received, the, prevailing, wage, requirement, shall, apply, for, the, duration, of, the, assistance, or, ten, years, after, the, project, opens, whichever, is, longer	building, service, employees, employed, facility, grants, tax, abatements, exemptions, assistance, total, financial, value, million, dollars, increase, energy, efficiency, electrification, upgrades, development, renewable, energies, climate, resiliency, paid, prevailing, wage, employers, engaged, provision, work, subject, reporting, compliance, requirements, article, maintain, action, difference, wages, actually, requirement, apply, duration, years, project, opens, whichever, longer	§ 6.8.	50
283	§ 7.	20.35 - 20.36	Article 8 of the public authorities law is amended by adding a new title 9-C to read as follows: 	article, 8, of, the, public, authorities, law, is, amended, by, adding, a, new, title, 9, c, to, read, as, follows	article, public, authorities, law, amended, adding, new, title, follows	§ 7.	9
284	TITLE 9-C	20.37 - 20.38	CLIMATE CHANGE JUST TRANSITION 	climate, change, just, transition	climate, transition	(§7.) TITLE 9-C	2
285	SUBTITLE I	20.39 - 20.40	GENERAL PROVISIONS 	general, provisions	general, provisions	(§7.) SUBTITLE I	2
286	Section 1910.	20.41 - 20.41	Definitions. 	definitions	definitions	(§7.) SUBTITLE I § 1910.	1
287	1911.	20.42 - 20.42	Coordination of programs. 	coordination, of, programs	coordination, programs	(§7.) SUBTITLE I § 1911.	2
288	1912.	20.43 - 20.43	Transparency and accountability. 	transparency, and, accountability	transparency, accountability	(§7.) SUBTITLE I § 1912.	2
289	1913.	20.44 - 20.44	Report on community ownership. 	report, on, community, ownership	report, community, ownership	(§7.) SUBTITLE I § 1913.	3
290	SUBTITLE II	20.45 - 20.46	COMMUNITY JUST TRANSITION 	community, just, transition	community, transition	(§7.) SUBTITLE II	2
291	Section 1914.	20.47 - 20.47	Definitions. 	definitions	definitions	(§7.) SUBTITLE II § 1914.	1
292	1915.	20.48 - 20.48	Office of community just transition. 	office, of, community, just, transition	office, community, transition	(§7.) SUBTITLE II § 1915.	3
293	1916.	20.49 - 20.49	Establishment of community just transition program. 	establishment, of, community, just, transition, program	establishment, community, transition, program	(§7.) SUBTITLE II § 1916.	4
294	1917.	20.50 - 20.50	Administration by the authority. 	administration, by, the, authority	administration, authority	(§7.) SUBTITLE II § 1917.	2
295	1918.	20.51 - 20.51	Allocation of funds. 	allocation, of, funds	allocation, funds	(§7.) SUBTITLE II § 1918.	2
296	1919.	20.52 - 20.52	Selection process. 	selection, process	selection, process	(§7.) SUBTITLE II § 1919.	2
297	1920.	20.53 - 20.53	Identification of disadvantaged community needs. 	identification, of, disadvantaged, community, needs	identification, disadvantaged, community, needs	(§7.) SUBTITLE II § 1920.	4
298	1921.	20.54 - 20.54	Community decision-making and accountability mechanisms. 	community, decision, making, and, accountability, mechanisms	community, decision, accountability, mechanisms	(§7.) SUBTITLE II § 1921.	4
299	1922.	21.1 - 21.2	Criteria for implementing community accountability mechanisms. 	criteria, for, implementing, community, accountability, mechanisms	criteria, implementing, community, accountability, mechanisms	(§7.) SUBTITLE II § 1922.	5
300	1923.	21.3 - 21.3	Consultation with the working group. 	consultation, with, the, working, group	consultation, working, group	(§7.) SUBTITLE II § 1923.	3
301	SUBTITLE III	21.4 - 21.5	CLIMATE JOBS AND INFRASTRUCTURE 	climate, jobs, and, infrastructure	climate, jobs, infrastructure	(§7.) SUBTITLE III	3
302	Section 1924.	21.6 - 21.6	Definitions. 	definitions	definitions	(§7.) SUBTITLE III § 1924.	1
303	1925.	21.7 - 21.7	Establishment of climate jobs and infrastructure program. 	establishment, of, climate, jobs, and, infrastructure, program	establishment, climate, jobs, infrastructure, program	(§7.) SUBTITLE III § 1925.	5
304	1926.	21.8 - 21.8	Administration by the authority. 	administration, by, the, authority	administration, authority	(§7.) SUBTITLE III § 1926.	2
305	1927.	21.9 - 21.9	Allocation of funds. 	allocation, of, funds	allocation, funds	(§7.) SUBTITLE III § 1927.	2
306	1928.	21.10 - 21.10	Funding instruments. 	funding, instruments	funding, instruments	(§7.) SUBTITLE III § 1928.	2
307	1929.	21.11 - 21.11	Selection process and criteria. 	selection, process, and, criteria	selection, process, criteria	(§7.) SUBTITLE III § 1929.	3
308	1930.	21.12 - 21.12	Consultation with the advisory council. 	consultation, with, the, advisory, council	consultation, advisory, council	(§7.) SUBTITLE III § 1930.	3
309	1931.	21.13 - 21.13	Comprehensive approach to existing structures. 	comprehensive, approach, to, existing, structures	comprehensive, approach, existing, structures	(§7.) SUBTITLE III § 1931.	4
310	1932.	21.14 - 21.15	Advisory council of the climate jobs and infrastructure program. 	advisory, council, of, the, climate, jobs, and, infrastructure, program	advisory, council, climate, jobs, infrastructure, program	(§7.) SUBTITLE III § 1932.	6
311	SUBTITLE IV	21.16 - 21.17	JUST TRANSITION FOR IMPACTED WORKERS AND COMMUNITY ASSURANCE 	just, transition, for, impacted, workers, and, community, assurance	transition, impacted, workers, community, assurance	(§7.) SUBTITLE IV	5
312	Section 1933.	21.18 - 21.18	Definitions. 	definitions	definitions	(§7.) SUBTITLE IV § 1933.	1
313	1934.	21.19 - 21.19	Establishment of worker and community assurance board. 	establishment, of, worker, and, community, assurance, board	establishment, worker, community, assurance, board	(§7.) SUBTITLE IV § 1934.	5
314	1935.	21.20 - 21.20	Establishment of worker assurance program. 	establishment, of, worker, assurance, program	establishment, worker, assurance, program	(§7.) SUBTITLE IV § 1935.	4
315	1936.	21.21 - 21.21	Establishment of community assurance program. 	establishment, of, community, assurance, program	establishment, community, assurance, program	(§7.) SUBTITLE IV § 1936.	4
316	1937.	21.22 - 21.22	Administration. 	administration	administration	(§7.) SUBTITLE IV § 1937.	1
317	1938.	21.23 - 21.23	Allocation of funds. 	allocation, of, funds	allocation, funds	(§7.) SUBTITLE IV § 1938.	2
318	1939.	21.24 - 21.24	Selection process. 	selection, process	selection, process	(§7.) SUBTITLE IV § 1939.	2
319	1939-a.	21.25 - 21.25	Designation of significant impact. 	designation, of, significant, impact	designation, significant, impact	(§7.) SUBTITLE IV § 1939-a.	3
320	1939-b.	21.26 - 21.26	Public engagement and social dialogue. 	public, engagement, and, social, dialogue	public, engagement, social, dialogue	(§7.) SUBTITLE IV § 1939-b.	4
321	1939-c.	21.27 - 21.27	Reporting. 	reporting	reporting	(§7.) SUBTITLE IV § 1939-c.	1
322	§ 1910.	21.28 - 21.29	Definitions. For the purposes of this subtitle, the following terms shall have the following meanings: 	definitions, for, the, purposes, of, this, subtitle, the, following, terms, shall, have, the, following, meanings	definitions, purposes, subtitle, terms, meanings	(§7.) SUBTITLE IV § 1910.	5
323	1.	21.30 - 21.31	"""Advisory council"" means the advisory council established under section nineteen hundred thirty-two of this title. "	advisory, council, means, the, advisory, council, established, under, section, nineteen, hundred, thirty, two, of, this, title	advisory, council, established, hundred, title	(§7.) SUBTITLE IV § 1910.1.	5
324	2.	21.32 - 21.32	"""Authority"" means the climate and community investment authority. "	authority, means, the, climate, and, community, investment, authority	authority, climate, community, investment	(§7.) SUBTITLE IV § 1910.2.	4
325	3.	21.33 - 21.35	"""Community ownership"" means projects, businesses and legal models in regard to renewable energy assets and services that allow for one or more of the following: "	community, ownership, means, projects, businesses, and, legal, models, in, regard, to, renewable, energy, assets, and, services, that, allow, for, one, or, more, of, the, following	community, ownership, projects, businesses, legal, models, regard, renewable, energy, assets, services, allow	(§7.) SUBTITLE IV § 1910.3.	12
326	(a)	21.36 - 21.38	the flow of benefits from energy generation and conservation goes directly to communities and utility customers while minimizing the extraction of benefits and profit by third-parties; 	the, flow, of, benefits, from, energy, generation, and, conservation, goes, directly, to, communities, and, utility, customers, while, minimizing, the, extraction, of, benefits, and, profit, by, third, parties	flow, benefits, energy, generation, conservation, goes, directly, communities, utility, customers, minimizing, extraction, profit, parties	(§7.) SUBTITLE IV § 1910.3.(a)	14
327	(b)	21.39 - 21.42	access to energy infrastructure ownership, including energy efficiency measures and savings, by renters, non-profit organizations, and individuals with a broader spectrum of income and credit profiles than traditional financing allows for; 	access, to, energy, infrastructure, ownership, including, energy, efficiency, measures, and, savings, by, renters, non, profit, organizations, and, individuals, with, a, broader, spectrum, of, income, and, credit, profiles, than, traditional, financing, allows, for	access, energy, infrastructure, ownership, efficiency, measures, savings, renters, profit, organizations, individuals, broader, spectrum, income, credit, profiles, traditional, financing, allows	(§7.) SUBTITLE IV § 1910.3.(b)	19
328	(c)	21.43 - 21.44	creation of cooperative and cooperative-like structures for the development and ownership of energy infrastructure; and 	creation, of, cooperative, and, cooperative, like, structures, for, the, development, and, ownership, of, energy, infrastructure, and	creation, cooperative, structures, development, ownership, energy, infrastructure	(§7.) SUBTITLE IV § 1910.3.(c)	7
329	(d)	21.45 - 21.46	ownership by individuals or organizations that are located where a project is sited. 	ownership, by, individuals, or, organizations, that, are, located, where, a, project, is, sited	ownership, individuals, organizations, located, project, sited	(§7.) SUBTITLE IV § 1910.3.(d)	6
330	4.	21.47 - 21.51	"""Constituency-based organization"" means an organization incorporated for the purpose of providing services or other assistance to economically or socially disadvantaged persons within a specified community, and which is supported by, or whose actions are directed by, members of the community in which it operates. "	constituency, based, organization, means, an, organization, incorporated, for, the, purpose, of, providing, services, or, other, assistance, to, economically, or, socially, disadvantaged, persons, within, a, specified, community, and, which, is, supported, by, or, whose, actions, are, directed, by, members, of, the, community, in, which, it, operates	constituency, organization, incorporated, purpose, providing, services, assistance, economically, socially, disadvantaged, persons, specified, community, supported, whose, actions, directed, members, operates	(§7.) SUBTITLE IV § 1910.4.	19
331	5.	21.52 - 21.54	"""Director"" means the director of an office appointed under paragraph (b) of subdivision seven of section twenty-seven hundred ninetynine-uuuu of this article. "	director, means, the, director, of, an, office, appointed, under, paragraph, b, of, subdivision, seven, of, section, twenty, seven, hundred, ninetynine, uuuu, of, this, article	director, office, appointed, paragraph, subdivision, hundred, ninetynine, uuuu, article	(§7.) SUBTITLE IV § 1910.5.	9
332	6.	22.1 - 22.4	"""Disadvantaged communities"" means communities that bear burdens of negative public health effects, environmental pollution, and impacts of climate change, and possess certain socioeconomic criteria, as identified pursuant to section 75-0111 of the environmental conservation law. "	disadvantaged, communities, means, communities, that, bear, burdens, of, negative, public, health, effects, environmental, pollution, and, impacts, of, climate, change, and, possess, certain, socioeconomic, criteria, as, identified, pursuant, to, section, 75, 0111, of, the, environmental, conservation, law	disadvantaged, communities, bear, burdens, negative, public, health, effects, environmental, pollution, impacts, climate, possess, certain, socioeconomic, criteria, identified, pursuant, conservation, law	(§7.) SUBTITLE IV § 1910.6.	20
333	7.	22.5 - 22.6	"""Downstate region"" means the counties of Richmond, Kings, Queens, New York, Bronx, Westchester, Nassau and Suffolk. "	downstate, region, means, the, counties, of, richmond, kings, queens, new, york, bronx, westchester, nassau, and, suffolk	downstate, region, counties, richmond, kings, queens, new, york, bronx, westchester, nassau, suffolk	(§7.) SUBTITLE IV § 1910.7.	12
334	8.	22.7 - 22.9	"""Emissions leakage"" means an increase in emissions outside of the state, as a result of, or in correlation with, the implementation of measures within the state to limit such emissions. "	emissions, leakage, means, an, increase, in, emissions, outside, of, the, state, as, a, result, of, or, in, correlation, with, the, implementation, of, measures, within, the, state, to, limit, such, emissions	emissions, leakage, increase, outside, state, correlation, implementation, measures, limit	(§7.) SUBTITLE IV § 1910.8.	9
335	9.	22.10 - 22.11	"""Greenhouse gas"" shall have the same meaning as in subdivision eight of section 19-1301 of the environmental conservation law. "	greenhouse, gas, shall, have, the, same, meaning, as, in, subdivision, eight, of, section, 19, 1301, of, the, environmental, conservation, law	greenhouse, gas, meaning, subdivision, environmental, conservation, law	(§7.) SUBTITLE IV § 1910.9.	7
336	10.	22.12 - 22.13	"""Office"" means the office of climate and community investment established under this title. "	office, means, the, office, of, climate, and, community, investment, established, under, this, title	office, climate, community, investment, established, title	(§7.) SUBTITLE IV § 1910.10.	6
337	11.	22.14 - 22.15	"""Municipality"" shall have the same meaning as in subdivision six of section four hundred eighty-one of the executive law. "	municipality, shall, have, the, same, meaning, as, in, subdivision, six, of, section, four, hundred, eighty, one, of, the, executive, law	municipality, meaning, subdivision, hundred, executive, law	(§7.) SUBTITLE IV § 1910.11.	6
338	12.	22.16 - 22.18	"""Regulated air contaminant"" shall have the same meaning as in subdivision twenty-two of section 19-0107 of the environmental conservation law. "	regulated, air, contaminant, shall, have, the, same, meaning, as, in, subdivision, twenty, two, of, section, 19, 0107, of, the, environmental, conservation, law	regulated, air, contaminant, meaning, subdivision, environmental, conservation, law	(§7.) SUBTITLE IV § 1910.12.	8
339	13.	22.19 - 22.19	"""President"" means the president of the authority. "	president, means, the, president, of, the, authority	president, authority	(§7.) SUBTITLE IV § 1910.13.	2
340	14.	22.20 - 22.27	"""Tribal nation"" means those tribes, nations or other organized groups of persons having origins in any of the original peoples of North America recognized in the state or considered by the federal secretary of the interior to be a tribal nation, including the following New York state tribal nations: Cayuga Nation, Oneida Nation of New York, Onondaga Nation, Poospatuck or Unkechauge Nation, Saint Regis Mohawk Tribe, Seneca Nation of Indians, Shinnecock Indian Nation, Tonawanda Band of Seneca and Tuscarora Nation. "	tribal, nation, means, those, tribes, nations, or, other, organized, groups, of, persons, having, origins, in, any, of, the, original, peoples, of, north, america, recognized, in, the, state, or, considered, by, the, federal, secretary, of, the, interior, to, be, a, tribal, nation, including, the, following, new, york, state, tribal, nations, cayuga, nation, oneida, nation, of, new, york, onondaga, nation, poospatuck, or, unkechauge, nation, saint, regis, mohawk, tribe, seneca, nation, of, indians, shinnecock, indian, nation, tonawanda, band, of, seneca, and, tuscarora, nation	tribal, nation, tribes, nations, organized, persons, origins, original, peoples, north, america, recognized, state, considered, federal, secretary, interior, new, york, cayuga, oneida, onondaga, poospatuck, unkechauge, saint, regis, mohawk, tribe, seneca, indians, shinnecock, indian, tonawanda, band, tuscarora	(§7.) SUBTITLE IV § 1910.14.	35
341	15.	22.28 - 22.29	"""Upstate region"" means all New York counties other than Nassau, Suffolk, Richmond, Kings, Queens, New York, Bronx and Westchester. "	upstate, region, means, all, new, york, counties, other, than, nassau, suffolk, richmond, kings, queens, new, york, bronx, and, westchester	upstate, region, new, york, counties, nassau, suffolk, richmond, kings, queens, bronx, westchester	(§7.) SUBTITLE IV § 1910.15.	12
342	16.	22.30 - 22.31	"""Working group"" means the climate justice working group created pursuant to section 75-0111 of the environmental conservation law. "	working, group, means, the, climate, justice, working, group, created, pursuant, to, section, 75, 0111, of, the, environmental, conservation, law	working, group, climate, justice, pursuant, environmental, conservation, law	(§7.) SUBTITLE IV § 1910.16.	8
343	§ 1911.	22.32 - 22.35	Coordination of programs. The authority shall undertake actions to ensure maximum coordination between each of the programs created under section three thousand forty-six of the tax law, including: 	coordination, of, programs, the, authority, shall, undertake, actions, to, ensure, maximum, coordination, between, each, of, the, programs, created, under, section, three, thousand, forty, six, of, the, tax, law, including	coordination, programs, authority, undertake, actions, ensure, maximum, thousand, tax, law	(§7.) SUBTITLE IV § 1911.	10
344	1.	22.36 - 22.36	conducting each program such that all three programs together: 	conducting, each, program, such, that, all, three, programs, together	conducting, program, programs	(§7.) SUBTITLE IV § 1911.1.	3
345	(a)	22.37 - 22.37	maximize the total economic and social benefits to New York; 	maximize, the, total, economic, and, social, benefits, to, new, york	maximize, total, economic, social, benefits, new, york	(§7.) SUBTITLE IV § 1911.1.(a)	7
346	(b)	22.38 - 22.38	maximize administrative efficiency; 	maximize, administrative, efficiency	maximize, administrative, efficiency	(§7.) SUBTITLE IV § 1911.1.(b)	3
347	(c)	22.39 - 22.40	achieve the most cost-effective and the greatest amount of reductions in greenhouse gas emissions and regulated air contaminants; 	achieve, the, most, cost, effective, and, the, greatest, amount, of, reductions, in, greenhouse, gas, emissions, and, regulated, air, contaminants	achieve, cost, effective, greatest, amount, reductions, greenhouse, gas, emissions, regulated, air, contaminants	(§7.) SUBTITLE IV § 1911.1.(c)	12
348	(d)	22.41 - 22.41	achieve an equitable distribution of funds; 	achieve, an, equitable, distribution, of, funds	achieve, equitable, distribution, funds	(§7.) SUBTITLE IV § 1911.1.(d)	4
