Item	Outline	Page_Lines	Text	Tokens	Keywords	Tag	Number_of_Keywords
616	2.	38.7 - 38.9	to provide support for disadvantaged communities and significantly impacted communities directly from the authority, through local government entities, eligible lead applicants, or eligible sub-applicants to: 	to, provide, support, for, disadvantaged, communities, and, significantly, impacted, communities, directly, from, the, authority, through, local, government, entities, eligible, lead, applicants, or, eligible, sub, applicants, to	support, disadvantaged, communities, significantly, impacted, directly, authority, local, government, entities, eligible, lead, applicants, sub	(§7.) SUBTITLE IV § 1936.2.	14
617	(a)	38.10 - 38.11	replace lost school aid, lost property tax payments to schools, or other lost school funding; 	replace, lost, school, aid, lost, property, tax, payments, to, schools, or, other, lost, school, funding	replace, lost, school, aid, property, tax, payments, schools, funding	(§7.) SUBTITLE IV § 1936.2.(a)	9
618	(b)	38.12 - 38.12	job creation programs; 	job, creation, programs	job, creation, programs	(§7.) SUBTITLE IV § 1936.2.(b)	3
619	(c)	38.13 - 38.17	replace lost payment in-lieu-of taxes (PILOT) and local tax revenue, replace revenue raised by or paid by the state or an employer to municipalities or school districts (including, but not limited to, central school districts and city school districts), and other public funding that is being lost; and 	replace, lost, payment, in, lieu, of, taxes, pilot, and, local, tax, revenue, replace, revenue, raised, by, or, paid, by, the, state, or, an, employer, to, municipalities, or, school, districts, including, but, not, limited, to, central, school, districts, and, city, school, districts, and, other, public, funding, that, is, being, lost, and	replace, lost, payment, lieu, taxes, pilot, local, tax, revenue, raised, paid, state, employer, municipalities, school, districts, limited, central, city, public, funding	(§7.) SUBTITLE IV § 1936.2.(c)	21
620	(d)	38.18 - 38.20	facilitate the expansion of existing economic development programs to enable communities to respond to permanent facility closure and/or major reductions in property taxes or pilot payments; and 	facilitate, the, expansion, of, existing, economic, development, programs, to, enable, communities, to, respond, to, permanent, facility, closure, and, or, major, reductions, in, property, taxes, or, pilot, payments, and	facilitate, expansion, existing, economic, development, programs, enable, communities, respond, permanent, facility, closure, major, reductions, property, taxes, pilot, payments	(§7.) SUBTITLE IV § 1936.2.(d)	18
621	3.	38.21 - 38.21	proposals for program funding may include, but are not limited to: 	proposals, for, program, funding, may, include, but, are, not, limited, to	proposals, program, funding, may, limited	(§7.) SUBTITLE IV § 1936.3.	5
622	(a)	38.22 - 38.23	support to start cooperative employee-owned businesses, including by displaced workers or labor organizations; 	support, to, start, cooperative, employee, owned, businesses, including, by, displaced, workers, or, labor, organizations	support, cooperative, employee, owned, businesses, displaced, workers, labor, organizations	(§7.) SUBTITLE IV § 1936.3.(a)	9
623	(b)	38.24 - 38.25	infrastructure projects in communities where energy-intensive facilities are closing; 	infrastructure, projects, in, communities, where, energy, intensive, facilities, are, closing	infrastructure, projects, communities, energy, intensive, facilities, closing	(§7.) SUBTITLE IV § 1936.3.(b)	7
624	(c)	38.26 - 38.27	efforts at reclamation project creating a renewable project located at: 	efforts, at, reclamation, project, creating, a, renewable, project, located, at	efforts, reclamation, project, creating, renewable, located	(§7.) SUBTITLE IV § 1936.3.(c)	6
625	(i)	38.28 - 38.31	a brownfield site as defined in subdivision two of section 27-1405 of the environmental conservation law, not excluding a site subject to an enforcement order as provided for in paragraph (c) of subdivision two of section 27-1405 of the environmental conservation law; 	a, brownfield, site, as, defined, in, subdivision, two, of, section, 27, 1405, of, the, environmental, conservation, law, not, excluding, a, site, subject, to, an, enforcement, order, as, provided, for, in, paragraph, c, of, subdivision, two, of, section, 27, 1405, of, the, environmental, conservation, law	brownfield, defined, subdivision, environmental, conservation, law, excluding, subject, enforcement, order, paragraph	(§7.) SUBTITLE IV § 1936.3.(c)(i)	11
626	(ii)	38.32 - 38.33	a dormant electric generating site as determined by the commission; or 	a, dormant, electric, generating, site, as, determined, by, the, commission, or	dormant, electric, generating, determined, commission	(§7.) SUBTITLE IV § 1936.3.(c)(ii)	5
627	(iii)	38.34 - 38.35	real property owned by a private developer or real property owned by an applicable firm. 	real, property, owned, by, a, private, developer, or, real, property, owned, by, an, applicable, firm	property, owned, private, developer, applicable, firm	(§7.) SUBTITLE IV § 1936.3.(c)(iii)	6
628	(d)	38.36 - 38.38	projects proposed through negotiated project labor agreements or neutrality agreements with labor organizations representing impacted workers or adversely affected workers. 	projects, proposed, through, negotiated, project, labor, agreements, or, neutrality, agreements, with, labor, organizations, representing, impacted, workers, or, adversely, affected, workers	projects, proposed, negotiated, project, labor, agreements, neutrality, organizations, representing, impacted, workers, adversely, affected	(§7.) SUBTITLE IV § 1936.3.(d)	13
629	(e)	38.39 - 38.44	small business retraining and transition programs. Including programs to identify and support small businesses, to avoid job losses due to energy transition, make technological changes or training improvements, on the job training programs, equipment grants, and technical support for existing businesses to transition to practices focused on sustainability, decarbonization, or non-emitting operations. 	small, business, retraining, and, transition, programs, including, programs, to, identify, and, support, small, businesses, to, avoid, job, losses, due, to, energy, transition, make, technological, changes, or, training, improvements, on, the, job, training, programs, equipment, grants, and, technical, support, for, existing, businesses, to, transition, to, practices, focused, on, sustainability, decarbonization, or, non, emitting, operations	business, retraining, transition, programs, identify, support, businesses, avoid, job, losses, energy, technological, training, improvements, equipment, grants, technical, existing, practices, focused, sustainability, decarbonization, emitting, operations	(§7.) SUBTITLE IV § 1936.3.(e)	24
630	(f)	38.45 - 38.47	support for local manufacturing coordinated with decarbonization programs to provide grants and no-interest loans to develop and accelerate manufacturing of: 	support, for, local, manufacturing, coordinated, with, decarbonization, programs, to, provide, grants, and, no, interest, loans, to, develop, and, accelerate, manufacturing, of	support, local, manufacturing, coordinated, decarbonization, programs, grants, interest, loans, develop, accelerate	(§7.) SUBTITLE IV § 1936.3.(f)	11
631	(i)	38.48 - 38.49	electric buses (including school buses), electric pickup trucks, electric cars, and other electric vehicles; and 	electric, buses, including, school, buses, electric, pickup, trucks, electric, cars, and, other, electric, vehicles, and	electric, buses, school, pickup, trucks, cars, vehicles	(§7.) SUBTITLE IV § 1936.3.(f)(i)	7
632	(ii)	38.50 - 38.51	energy-efficient electric appliances in significantly impacted communities and adversely affected communities. 	energy, efficient, electric, appliances, in, significantly, impacted, communities, and, adversely, affected, communities	energy, efficient, electric, appliances, significantly, impacted, communities, adversely, affected	(§7.) SUBTITLE IV § 1936.3.(f)(ii)	9
633	1.	38.52 - 38.55	Administration. 1. Within six months of the effective date of this subtitle, the authority is hereby authorized and directed to establish the programs authorized by this subtitle. The authority shall implement the programs in consultation with the board and shall: 	administration, 1, within, six, months, of, the, effective, date, of, this, subtitle, the, authority, is, hereby, authorized, and, directed, to, establish, the, programs, authorized, by, this, subtitle, the, authority, shall, implement, the, programs, in, consultation, with, the, board, and, shall	administration, months, effective, subtitle, authority, hereby, authorized, directed, establish, programs, implement, consultation, board	(§7.) SUBTITLE IV § 1937.1.	13
634	(a)	39.1 - 39.6	use monies made available for the programs for the establishment of worker and community assurance board pursuant to section nineteen hundred thirty-four, the establishment of the worker assurance program pursuant to section nineteen hundred thirty-five, and the community assurance program pursuant to section nineteen hundred thirty-six of this subtitle to achieve the purposes of each program; 	use, monies, made, available, for, the, programs, for, the, establishment, of, worker, and, community, assurance, board, pursuant, to, section, nineteen, hundred, thirty, four, the, establishment, of, the, worker, assurance, program, pursuant, to, section, nineteen, hundred, thirty, five, and, the, community, assurance, program, pursuant, to, section, nineteen, hundred, thirty, six, of, this, subtitle, to, achieve, the, purposes, of, each, program	monies, available, programs, establishment, worker, community, assurance, board, pursuant, hundred, program, subtitle, achieve, purposes	(§7.) SUBTITLE IV § 1937.1.(a)	14
635	(b)	39.7 - 39.9	enter into contracts with eligible lead applicants, eligible subapplicants, and other entities through the competitive selection process authorized by this subtitle; 	enter, into, contracts, with, eligible, lead, applicants, eligible, subapplicants, and, other, entities, through, the, competitive, selection, process, authorized, by, this, subtitle	contracts, eligible, lead, applicants, subapplicants, entities, competitive, selection, process, authorized, subtitle	(§7.) SUBTITLE IV § 1937.1.(b)	11
636	(c)	39.10 - 39.11	enter into contracts with one or more program implementers to perform such functions as the authority deems appropriate; 	enter, into, contracts, with, one, or, more, program, implementers, to, perform, such, functions, as, the, authority, deems, appropriate	contracts, program, implementers, perform, functions, authority, deems, appropriate	(§7.) SUBTITLE IV § 1937.1.(c)	8
637	(d)	39.12 - 39.17	evaluate disadvantaged communities and other communities to identify those where permanent facility closure is likely, and engage in outreach to ensure that constituency-based organizations, labor organizations, and eligible applicants are aware that the program is under development and invite them to be involved in the development of the program; and 	evaluate, disadvantaged, communities, and, other, communities, to, identify, those, where, permanent, facility, closure, is, likely, and, engage, in, outreach, to, ensure, that, constituency, based, organizations, labor, organizations, and, eligible, applicants, are, aware, that, the, program, is, under, development, and, invite, them, to, be, involved, in, the, development, of, the, program, and	evaluate, disadvantaged, communities, identify, permanent, facility, closure, likely, engage, outreach, ensure, constituency, organizations, labor, eligible, applicants, aware, program, development, invite, involved	(§7.) SUBTITLE IV § 1937.1.(d)	21
638	(e)	39.18 - 39.19	exercise such other powers as are necessary for the proper administration of the program. 	exercise, such, other, powers, as, are, necessary, for, the, proper, administration, of, the, program	exercise, powers, necessary, proper, administration, program	(§7.) SUBTITLE IV § 1937.1.(e)	6
639	2.	39.20 - 39.22	The authority shall notify labor organizations party to collective bargaining agreements covering workers in significantly impacted communities of proposed programs or funding opportunities under this section. 	the, authority, shall, notify, labor, organizations, party, to, collective, bargaining, agreements, covering, workers, in, significantly, impacted, communities, of, proposed, programs, or, funding, opportunities, under, this, section	authority, notify, labor, organizations, collective, bargaining, agreements, covering, workers, significantly, impacted, communities, proposed, programs, funding, opportunities	(§7.) SUBTITLE IV § 1937.2.	16
640	1.	39.23 - 39.28	Allocation of funds. 1. Funds from the fund shall be disbursed under the programs and be used to ensure a stable transition for workers and communities impacted by the transition to a carbon free economy. Funds may be used for activities pursuant to sections nineteen hundred thirty-four, nineteen hundred thirty-five and nineteen hundred thirtysix of this subtitle. 	allocation, of, funds, 1, funds, from, the, fund, shall, be, disbursed, under, the, programs, and, be, used, to, ensure, a, stable, transition, for, workers, and, communities, impacted, by, the, transition, to, a, carbon, free, economy, funds, may, be, used, for, activities, pursuant, to, sections, nineteen, hundred, thirty, four, nineteen, hundred, thirty, five, and, nineteen, hundred, thirtysix, of, this, subtitle	allocation, funds, fund, disbursed, programs, ensure, stable, transition, workers, communities, impacted, carbon, economy, may, activities, pursuant, sections, hundred, thirtysix, subtitle	(§7.) SUBTITLE IV § 1938.1.	20
641	2.	39.29 - 39.29	The authority shall: 	the, authority, shall	authority	(§7.) SUBTITLE IV § 1938.2.	1
642	(a)	39.30 - 39.31	develop clear guidelines and engage in public comment before allocating funds; 	develop, clear, guidelines, and, engage, in, public, comment, before, allocating, funds	develop, guidelines, engage, public, comment, allocating, funds	(§7.) SUBTITLE IV § 1938.2.(a)	7
643	(b)	39.32 - 39.34	determine a transparent and consistent level of funding, program portfolio, and process for accessing that support in both the upstate region and the downstate region; and 	determine, a, transparent, and, consistent, level, of, funding, program, portfolio, and, process, for, accessing, that, support, in, both, the, upstate, region, and, the, downstate, region, and	determine, transparent, consistent, level, funding, program, portfolio, process, accessing, support, upstate, region, downstate	(§7.) SUBTITLE IV § 1938.2.(b)	13
644	(c)	39.35 - 39.38	coordinate with the New York state department of labor regarding the program administered by the authority that directs funds to individual New York residents pursuant to section nineteen hundred thirty-five of this subtitle; 	coordinate, with, the, new, york, state, department, of, labor, regarding, the, program, administered, by, the, authority, that, directs, funds, to, individual, new, york, residents, pursuant, to, section, nineteen, hundred, thirty, five, of, this, subtitle	coordinate, new, york, state, department, labor, regarding, program, administered, authority, directs, funds, individual, residents, pursuant, hundred, subtitle	(§7.) SUBTITLE IV § 1938.2.(c)	17
645	3. (a)	39.39 - 39.41	All projects funded pursuant to this section must be operated as zero-emission projects. No funds from this program may be awarded to any project that uses carbon-based-fuels in its operations. 	all, projects, funded, pursuant, to, this, section, must, be, operated, as, zero, emission, projects, no, funds, from, this, program, may, be, awarded, to, any, project, that, uses, carbon, based, fuels, in, its, operations	projects, funded, pursuant, operated, zero, emission, funds, program, may, awarded, project, uses, carbon, fuels, operations	(§7.) SUBTITLE IV § 1938.3. (a)	15
646	(b)	39.42 - 39.43	No funds under this subtitle shall fund police, prisons or related infrastructure. 	no, funds, under, this, subtitle, shall, fund, police, prisons, or, related, infrastructure	funds, subtitle, fund, police, prisons, related, infrastructure	(§7.) SUBTITLE IV § 1938.3. (a)(b)	7
647	(c)	39.44 - 39.47	Funds administered under section nineteen hundred thirty-six of this subtitle should be coordinated whenever possible with existing programs, and with funding opportunities under other subtitles of this title. 	funds, administered, under, section, nineteen, hundred, thirty, six, of, this, subtitle, should, be, coordinated, whenever, possible, with, existing, programs, and, with, funding, opportunities, under, other, subtitles, of, this, title	funds, administered, hundred, subtitle, coordinated, whenever, possible, existing, programs, funding, opportunities, subtitles, title	(§7.) SUBTITLE IV § 1938.3. (a)(c)	13
648	§ 1939.	39.48 - 39.50	Selection process. The director is authorized, within amounts appropriated, to disburse funds from the fund on a competitive basis for approved projects to eligible applicants and partners. 	selection, process, the, director, is, authorized, within, amounts, appropriated, to, disburse, funds, from, the, fund, on, a, competitive, basis, for, approved, projects, to, eligible, applicants, and, partners	selection, process, director, authorized, amounts, appropriated, disburse, funds, fund, competitive, basis, approved, projects, eligible, applicants, partners	(§7.) SUBTITLE IV § 1939.	16
649	1.	39.51 - 39.53	The director, in partnership with the task force and board, shall develop criteria and a process for selecting project proposals submitted by eligible applicants under this subtitle. 	the, director, in, partnership, with, the, task, force, and, board, shall, develop, criteria, and, a, process, for, selecting, project, proposals, submitted, by, eligible, applicants, under, this, subtitle	director, partnership, task, force, board, develop, criteria, process, selecting, project, proposals, submitted, eligible, applicants, subtitle	(§7.) SUBTITLE IV § 1939.1.	15
650	2.	39.54 - 40.2	The board will select projects based on proposals from eligible lead applicants and labor organizations, based on task force's recommendation, or based on a request from an individual impacted workers and adversely affected workers. 	the, board, will, select, projects, based, on, proposals, from, eligible, lead, applicants, and, labor, organizations, based, on, task, force's, recommendation, or, based, on, a, request, from, an, individual, impacted, workers, and, adversely, affected, workers	board, select, projects, proposals, eligible, lead, applicants, labor, organizations, task, force's, recommendation, request, individual, impacted, workers, adversely, affected	(§7.) SUBTITLE IV § 1939.2.	18
651	3.	40.3 - 40.8	Proposals should clearly articulate: the programs to be supported; the number of workers impacted; overall expected funding level; a plan to engage the people most affected by the transition, including workers and community members; a plan for any necessary site remediation and economic development; and a plan to ensure that funding is time limited to no more than ten years of direct support from the fund. 	proposals, should, clearly, articulate, the, programs, to, be, supported, the, number, of, workers, impacted, overall, expected, funding, level, a, plan, to, engage, the, people, most, affected, by, the, transition, including, workers, and, community, members, a, plan, for, any, necessary, site, remediation, and, economic, development, and, a, plan, to, ensure, that, funding, is, time, limited, to, no, more, than, ten, years, of, direct, support, from, the, fund	proposals, clearly, articulate, programs, supported, number, workers, impacted, overall, expected, funding, level, plan, engage, affected, transition, community, members, necessary, remediation, economic, development, ensure, limited, years, direct, support, fund	(§7.) SUBTITLE IV § 1939.3.	28
652	4.	40.9 - 40.9	The authority shall give priority to proposals from or related to: 	the, authority, shall, give, priority, to, proposals, from, or, related, to	authority, priority, proposals, related	(§7.) SUBTITLE IV § 1939.4.	4
653	(a)	40.10 - 40.10	disadvantaged workers or disadvantaged communities; 	disadvantaged, workers, or, disadvantaged, communities	disadvantaged, workers, communities	(§7.) SUBTITLE IV § 1939.4.(a)	3
654	(b)	40.11 - 40.11	adversely affected workers; 	adversely, affected, workers	adversely, affected, workers	(§7.) SUBTITLE IV § 1939.4.(b)	3
655	(c)	40.12 - 40.12	eligible applicants that relate to adversely affected employment; 	eligible, applicants, that, relate, to, adversely, affected, employment	eligible, applicants, relate, adversely, affected, employment	(§7.) SUBTITLE IV § 1939.4.(c)	6
656	(d)	40.13 - 40.14	projects that have significant employment and tax base impacts when experiencing a permanent closure. 	projects, that, have, significant, employment, and, tax, base, impacts, when, experiencing, a, permanent, closure	projects, significant, employment, tax, base, impacts, experiencing, permanent, closure	(§7.) SUBTITLE IV § 1939.4.(d)	9
657	5.	40.15 - 40.18	Where a proposal is received and one or more labor organization represent impacted workers, they shall be notified, and given a reasonable opportunity to submit a proposal either on their own or in partnership with other eligible applicants. 	where, a, proposal, is, received, and, one, or, more, labor, organization, represent, impacted, workers, they, shall, be, notified, and, given, a, reasonable, opportunity, to, submit, a, proposal, either, on, their, own, or, in, partnership, with, other, eligible, applicants	proposal, labor, organization, represent, impacted, workers, notified, reasonable, opportunity, submit, partnership, eligible, applicants	(§7.) SUBTITLE IV § 1939.5.	13
658	6.	40.19 - 40.27	In developing the criteria, the authority and the board shall attempt to maximize: the number of people from affected communities that will benefit from any implemented project and from the suite of projects across the program; the degree of direct benefits delivered to affected communities; greenhouse gas and emissions reductions for regulated air contaminants; and, to the extent possible, the leveraging of private capital. The criteria and program shall be reevaluated and amended based on the social dialogue convened by the task force and regional working groups. 	in, developing, the, criteria, the, authority, and, the, board, shall, attempt, to, maximize, the, number, of, people, from, affected, communities, that, will, benefit, from, any, implemented, project, and, from, the, suite, of, projects, across, the, program, the, degree, of, direct, benefits, delivered, to, affected, communities, greenhouse, gas, and, emissions, reductions, for, regulated, air, contaminants, and, to, the, extent, possible, the, leveraging, of, private, capital, the, criteria, and, program, shall, be, reevaluated, and, amended, based, on, the, social, dialogue, convened, by, the, task, force, and, regional, working, groups	developing, criteria, authority, board, attempt, maximize, number, affected, communities, benefit, implemented, project, suite, projects, across, program, degree, direct, benefits, delivered, greenhouse, gas, emissions, reductions, regulated, air, contaminants, extent, possible, leveraging, private, capital, reevaluated, amended, social, dialogue, convened, task, force, regional, working	(§7.) SUBTITLE IV § 1939.6.	41
659	7.	40.28 - 40.32	The authority shall encourage lead eligible applicants to propose projects in partnership with other eligible lead applicants, and in partnership with eligible sub-applicants, and will notify all those parties involved if multiple proposals are received regarding the same site, workers, or community. 	the, authority, shall, encourage, lead, eligible, applicants, to, propose, projects, in, partnership, with, other, eligible, lead, applicants, and, in, partnership, with, eligible, sub, applicants, and, will, notify, all, those, parties, involved, if, multiple, proposals, are, received, regarding, the, same, site, workers, or, community	authority, encourage, lead, eligible, applicants, propose, projects, partnership, sub, notify, parties, involved, multiple, proposals, regarding, workers, community	(§7.) SUBTITLE IV § 1939.7.	17
660	8.	40.33 - 40.34	Where possible, the authority shall aim to distribute funds in an equitable manner by region of the state. 	where, possible, the, authority, shall, aim, to, distribute, funds, in, an, equitable, manner, by, region, of, the, state	possible, authority, aim, distribute, funds, equitable, manner, region, state	(§7.) SUBTITLE IV § 1939.8.	9
661	9.	40.35 - 40.38	If adequate funding is available, the authority may consider proposals related to other impacts associated with climate change that have the effect of causing job losses, including climate-related natural disasters. 	if, adequate, funding, is, available, the, authority, may, consider, proposals, related, to, other, impacts, associated, with, climate, change, that, have, the, effect, of, causing, job, losses, including, climate, related, natural, disasters	adequate, funding, available, authority, may, consider, proposals, related, impacts, associated, climate, effect, causing, job, losses, natural, disasters	(§7.) SUBTITLE IV § 1939.9.	17
